,banco,fecha,texto,src,rt,fav,palabras,country,type,place,desde,sigue_a,lo_siguen
0,BancoAzteca,2020-10-18 03:21:51,"BancoAzteca No se ocupen en su momento no quisieron solucionarlo, ahora el proceso se encuentra en la CondusefMX junto con el senadomexicano para una solución integral contra abusos bancarios por parte de personal administrativo y ejecutivo.   DiputadosMorena GobiernoMX SEGOB_mx",Twitter for iPad,0,0,ejecutivo,,,,2011-10-16 06:25:21,946,45
1,BancoAzteca,2020-10-18 02:58:19,Como ven a la rata de Salinas Pliego?? Les digo que no metan su dinero en su banco rata de BancoAzteca https://t.co/DXU8zrQg38,Twitter for iPad,2,0,"banco,dinero",,,,2012-04-07 17:04:30,13847,12137
4,BancoAzteca,2020-10-18 02:27:16,"¡Un diagnóstico oportuno puede salvar tu vida! Recuerda hacerte revisiones constantes y protegerte con un seguro como SeguroMujer, que te brinda apoyo en caso de requerirlo.   Conoce los beneficios, requisitos y restricciones en: 👉https://t.co/XSgMW4QL4o OctubreRosa https://t.co/JHPwHGUEKr",Twitter for iPhone,1,0,seguro,,,,2010-06-11 15:57:57,484,532
5,BancoAzteca,2020-10-18 01:56:03,"Si viviera el mítico ""Maquio"" Clouthier, habría llamado a un boicot social contra el sátrapa RicardoBSalinas ! Por lo pronto, los invito a dar ""me gusta"" a quienes apoyen boicot contra Azteca , contra BancoAzteca y tiendas Tiendas_Elektra ! Ánimo! https://t.co/62hS98okxr",Twitter for Android,170,0,,,,,2011-04-20 02:34:18,626,287
6,BancoAzteca,2020-10-18 01:40:53,atlasfc BancoAzteca Gracias ....pero por matar mi pasión ....,Twitter for iPhone,0,0,,MX,city,"Tlaquepaque, Jalisco",2010-02-04 01:03:18,355,114
7,BancoAzteca,2020-10-18 01:00:39,"atlasfc BancoAzteca atlasfc sale a jugar con un once SIN NINGÚN CANTERANO. Se acabó el mito de la mal llamada ""Academia del fútbol mexicano"".",Twitter for Android,0,1,llamada,,,,2014-04-22 15:35:26,3048,970
9,BancoAzteca,2020-10-18 00:50:21,"Esto va más allá de una pasión... es un sentimiento, no puedo parar...  ¡VAMOS ATLAS, CARAJO! 🙌  ¡A ganar el Clásico Tapatío junto a BancoAzteca!   LateConFuria 🔴⚫️ https://t.co/usMj8SaNuP",Twitter for Android,36,0,,,,,2012-03-26 21:10:25,442,720
10,BancoAzteca,2020-10-18 00:49:19,atlasfc Estotodo! Pechos fríos. Ya vayan pagando los 120 algún tenemos un bancoazteca,Twitter for Android,0,0,banco,,,,2016-08-17 04:12:12,94,24
11,BancoAzteca,2020-10-18 00:33:03,"Hace 3 meses mi papá fue a renovar contrato con Citibanamex en una de las pocas sucursales que daban servicio.  Pidieron un  celular, desde ahí BBVA_Mex BancoAzteca Coppel chopo_cercadeti entre otros hablan a todas horas preguntando por él. Donde está la confidencialidad?",Twitter for Android,1,0,"sucursal,servicio,servicio",,,,2012-08-24 20:08:02,574,387
12,BancoAzteca,2020-10-18 00:32:28,ClubPueblaMX BancoAzteca Que pasooo?? https://t.co/qydBb7cbyU,Twitter for iPhone,0,0,,,,,2020-06-02 03:45:20,54,0
13,BancoAzteca,2020-10-18 00:23:11,"CON FURIA, LUCHA Y HONOR!!!  BancoAzteca nos trae el once del Clásico Tapatío!!!  LateConFuria 🔴⚫️ https://t.co/o4zTkIni4a",Twitter for Android,12,0,,,,,2012-02-23 17:28:25,1119,1042
19,BancoAzteca,2020-10-17 23:56:26,atlasfc BancoAzteca Listos para ganar el clásico,Twitter for Android,0,0,,,,,2018-05-03 13:52:33,92,62
20,BancoAzteca,2020-10-17 23:54:28,"atlasfc jsolari17 BancoAzteca Yo había leído ,nervio , mffff .",Twitter for Android,0,0,,,,,2016-05-15 03:08:39,490,222
26,BancoAzteca,2020-10-17 23:50:36,"atlasfc BancoAzteca Con todo, cabrones!",Twitter for iPhone,0,1,,,,,2014-01-01 22:35:48,2543,1679
28,BancoAzteca,2020-10-17 23:43:20,Jorge_Berones16 atlasfc BancoAzteca Creciditos porque? 🤔 bueno... entre pendejos se apoyan,Twitter for Android,0,0,bueno,,,,2020-08-26 19:10:51,226,85
29,BancoAzteca,2020-10-17 23:41:41,Vahoooz abobarman Zmbks1 BancoAzteca Del mexicano,Twitter for Android,13,0,,,,,2011-02-05 02:45:45,540,554
30,BancoAzteca,2020-10-17 23:35:57,"ClubPueblaMX BancoAzteca Pasen, son bienvenidos! https://t.co/Bx9Dt0AQ1k",Twitter for Android,0,2,,,,,2015-05-09 01:01:45,1520,907
31,BancoAzteca,2020-10-17 23:27:54,"ClubPueblaMX BancoAzteca Que partidazo, nos están acomodando",Twitter for Android,0,0,,,,,2017-01-06 02:23:30,1127,116
32,BancoAzteca,2020-10-17 22:58:43,ClubPueblaMX BancoAzteca Enfranjadisima la tuya !!!!,Twitter for Android,0,0,,,,,2012-03-06 22:01:21,2098,3774
33,BancoAzteca,2020-10-17 22:53:57,ClubPueblaMX BancoAzteca Y QUE PARTIDAZO!!!!! 🤭🤭🤭🤭🤭,Twitter for Android,0,0,,,,,2010-12-11 01:12:15,4999,3719
34,BancoAzteca,2020-10-17 22:52:58,"TIOBRAVE ¡Hola! Buena tarde. Con gusto te apoyamos a verificar esta situación, sin embargo, es necesario validar algunos de tus datos personales, por lo que te pedimos contactarnos a través de DM, para mayor detalle. Quedamos pendientes de tu mensaje.",S1Gateway,0,0,,,,,2010-09-06 15:09:31,2987,26722
35,BancoAzteca,2020-10-17 22:44:57,BancoAzteca y si ya dejan de bloquear mi tarjeta cada que la uso?   Entiendo que es seguridad pero no mamen. Si ya use esa tarjeta 50 veces en la tienda por que siguen bloqueándola! 😡,Twitter for iPhone,0,0,"tarjeta,seguridad",,,,2011-04-04 21:22:13,882,6024
36,BancoAzteca,2020-10-17 22:44:01,"BancoAzteca Ahorita pregunto qué número de sucursal es,",Twitter for Android,0,0,sucursal,,,,2015-08-30 22:22:31,146,47
37,BancoAzteca,2020-10-17 22:43:29,"BancoAzteca Es una sucursal de azulemex, y aquí en la que estoy formada cm tonta, su gente solo deja pasar a quien va a tramitar crédito si vamos a retirar estamos en fila, y si son sus amigos pasas y si no pues aquí estoy esperando.",Twitter for Android,0,0,sucursal,,,,2015-08-30 22:22:31,146,47
38,BancoAzteca,2020-10-17 22:41:17,"FlorVelazco18 Hola Xochitl, buena tarde. Por favor cuéntanos más detalles de la experiencia que tuviste en sucursal, para nosotros es muy importante tu opinión y puedes estar seguro de que te vamos a ayudar.",S1Gateway,0,0,"sucursal,seguro",,,,2010-09-06 15:09:31,2987,26722
39,BancoAzteca,2020-10-17 22:37:36,"BancoAzteca  eres un asco neta mejora tus cajeros, tu app chida pero tus cajeros son un asco, y voy y retiro en caja y resulta que no tienen la cantidad que quiero neta que onda con ustedes que no tienen dinero súper mal BancoAzteca",Twitter for Android,0,0,"retiro,cajeros,app,dinero",,,,2015-08-30 22:22:31,146,47
41,BancoAzteca,2020-10-17 22:26:36,"CokieeBlees ¡Hola! Muy buena tarde, con gusto te apoyamos. ¿Nos puedes indicar si has tenido algún inconveniente con nuestros productos?",S1Gateway,0,0,,,,,2010-09-06 15:09:31,2987,26722
42,BancoAzteca,2020-10-17 22:18:14,ClubPueblaMX BancoAzteca Tan temprano te andan cogiendo?,Twitter for Android,0,1,,,,,2015-01-25 10:33:19,1088,434
43,BancoAzteca,2020-10-17 22:12:38,ClubPueblaMX BancoAzteca Ja partidazo?..partidazo de madre si no nos ponemos las pilas,Twitter for Android,0,1,,,,,2011-01-28 04:11:23,64,23
44,BancoAzteca,2020-10-17 21:52:11,"angelotirado QuirinoOC MazatlanFC BancoAzteca RicardoBSalinas El uso de recursos públicos para comprar el morelia no está bien, además estos recursos deberían de diversificarse en generar ferias del mango, ciruela, camarón, banda sinaloense, fotografía, etc y apoyar la economía del sur del edo. Y no solo maximizar utilidad a gruposalinas.",Twitter for Android,0,0,tc,,,,2009-05-01 19:01:14,990,184
45,BancoAzteca,2020-10-17 21:36:47,De verdad que no he conocido empresa más caca que BancoAzteca,Twitter for Android,0,3,,,,,2009-08-13 16:51:06,720,1903
46,BancoAzteca,2020-10-17 20:33:55,BancoAzteca Lo hice el día de ayer 16 de octubre e igual ese mismo día me la aprobaron,Twitter for Android,0,0,roba,,,,2014-12-28 03:52:20,67,857
47,BancoAzteca,2020-10-17 20:26:18,"EmmanuelAke12 ¡Hola Emmanuel! Muy buena tarde, con gusto te apoyamos. ¿Nos puedes indicar que día realizaste la solicitud de tu Tarjeta Oro a través de la App?",S1Gateway,0,0,,,,,2010-09-06 15:09:31,2987,26722
48,BancoAzteca,2020-10-17 20:24:40,callodehacha QuirinoOC MazatlanFC BancoAzteca RicardoBSalinas Su responsabilidad https://t.co/RvGVBy0suf,Twitter for iPhone,0,0,,,,,2009-07-08 04:49:52,135,81
49,BancoAzteca,2020-10-17 20:21:41,"Tamara_Vargas BancoAzteca Veci, se de esto. Mandame mensaje",Twitter Web App,0,0,,,,,2009-12-22 22:29:31,3820,1189
50,BancoAzteca,2020-10-17 20:20:09,"BancoAzteca Pedí mi tarjeta de crédito por la aplicación y me la aprobaron, me dijeron que me llamarían para comprobar los datos de mi domicilio y entregarmela ahí mismo, pero cuando respondo me terminan colgando, ya van 3 veces, hay alguna forma de ir a recogerlo a la sucursal?",Twitter for Android,0,0,"tarjeta,sucursal,roba",,,,2014-12-28 03:52:20,67,857
51,BancoAzteca,2020-10-17 20:04:16,"Ricardo722906 Hola Ricardo, buena tarde. Por favor cuéntanos más detalles de la experiencia que tuviste en sucursal, para nosotros es muy importante tu opinión y puedes estar seguro de que te vamos a ayudar.",S1Gateway,0,0,"sucursal,seguro",,,,2010-09-06 15:09:31,2987,26722
52,BancoAzteca,2020-10-17 19:59:24,"BancoAzteca No, no sabíamos ni la existencia de este crédito, llamé al número del que nos marcaron y la persona que me contestó se portó muy déspota, incluso me colgó, me dejó hablando.",Twitter for Android,0,0,,,,,2009-11-18 02:14:50,1001,5135
53,BancoAzteca,2020-10-17 19:52:35,RicardoBSalinas yoanisanchez Apoyando a BancoAzteca!! El único lugar que nos ofrece plata Libertad!!,Twitter for iPhone,0,1,ofrece,,,,2010-01-22 19:25:22,537,124
54,BancoAzteca,2020-10-17 19:51:35,BancoAzteca sucursal calzada se la viga casi eaq con cll del recreo nadie atiende caja. 20 min sola,Twitter for Android,0,0,sucursal,,,,2012-05-18 19:25:10,83,21
56,BancoAzteca,2020-10-17 19:46:45,"Tamara_Vargas Buenas tardes, Tamara. Comprendemos la situación que nos mencionas, ¿nos puedes indicar si ya acudiste a la sucursal para notificar lo sucedido? Ya que se tiene que verificar a detalle el tipo de crédito contratado.",S1Gateway,0,0,sucursal,,,,2010-09-06 15:09:31,2987,26722
57,BancoAzteca,2020-10-17 19:39:09,"Buena tarde BancoAzteca nos están llamando amenazando con embargar en nuestro domicilio, la cuenta era de mi hermano que lamentablemente falleció en mayo.  Qué podemos hacer?",Twitter for Android,0,0,cuenta,,,,2009-11-18 02:14:50,1001,5135
60,BancoAzteca,2020-10-17 19:27:21,"QuirinoOC MazatlanFC BancoAzteca RicardoBSalinas Que bien que se abra la economía, también se debería abrir paso a la congruencia no eliminando los apoyos a Ciencia y Tecnología respetando las reglas que siempre han cumplido los Científicos e Investigadores así como niños y jóvenes !!",Twitter Web App,0,0,,,,,2019-04-02 03:47:33,235,54
61,BancoAzteca,2020-10-17 19:15:36,"atlasfc BancoAzteca Hoy no hay excusas,  hay que ganar, cuidado con los errores infantiles y al querer salir jugando, también alerta al inicio y fin de cada tiempo,  estos putos ratonean y el arbitraje siempre les ayuda. No hay mañana,  hoy tenemos que ganar! !!",Twitter Web App,0,0,,,,,2009-11-10 01:42:19,56,29
62,BancoAzteca,2020-10-17 19:03:32,"lucybealva Con gusto podemos validar a detalle la información brindada en sucursal, para ello requerimos de algunos datos de carácter personal. ¿Nos puedes contactar vía DM?",S1Gateway,0,0,sucursal,,,,2010-09-06 15:09:31,2987,26722
65,BancoAzteca,2020-10-17 18:18:56,"BancoAzteca A Caray y porque me estaban cobrando un 10% en su sucursal plaza Candiles, Qro, Qro. para mi es un robo.",Twitter for iPhone,0,0,"sucursal,robo",MX,city,"Corregidora, Querétaro Arteaga",2011-09-26 16:46:50,995,213
66,BancoAzteca,2020-10-17 18:16:34,"RieseAbinadab EdgarBejarano12 QuirinoOC MazatlanFC BancoAzteca RicardoBSalinas Estoy de acuerdo, y si acaso, te pone like.",Twitter for Android,0,0,,,,,2010-04-24 02:55:21,46,13
68,BancoAzteca,2020-10-17 18:14:27,"lucybealva Hola Lucy, buenas tardes. Te comentamos que existe una comisión por depósito del 5% aproximadamente si te hacen un depósito fuera de tu región, en caso de transferencias no se cobra extra.",S1Gateway,0,0,transferencia,,,,2010-09-06 15:09:31,2987,26722
69,BancoAzteca,2020-10-17 18:09:26,"BancoAzteca El 14 de oct nos llamó Andrés Coronel, creo no. de folio y nos dio un teléfono para seguimiento, que llamaríamos viernes o sábado, el tel no existe, hoy acudimos a la suc 9698 y ya habían cancelado la cta de ahorro y no sabía el gte por que, nos están tomando el pelo",Twitter for Android,0,0,,,,,2019-11-21 16:01:20,29,0
70,BancoAzteca,2020-10-17 18:06:24,"BancoAzteca Como puedo recuperar mi dinero transferencia no hecha por el cliente, ya que es una persona invidente, no usa aplicaciones ni nada de eso, esto fue en la suc 9698, paseo del bosque en Izcalli, cajera Frida Alejandra, gerente Alberto Hdz que no sabe protocolos",Twitter for Android,0,0,"cliente,transferencia,aplicacion,dinero",,,,2019-11-21 16:01:20,29,0
71,BancoAzteca,2020-10-17 18:01:55,"Hoy me di una vuelta por VanGoghAliveMx. Si están empezando a salir con todas las medidas de cuidado y sana distancia por el COVID, este es un plan familiar 100% recomendable. Sin aglomeraciones. No tocas nada. Solo disfrutas. Está espectacular. 👊🏻 MustWantedG BancoAzteca https://t.co/8W17op8AO5",Twitter for iPhone,2,0,,,,,2012-02-25 14:30:50,1238,361
72,BancoAzteca,2020-10-17 17:58:06,"CarmenJ04711418 Buenas Tardes, quedamos a tus ordenes para apoyarte con la situación que hayas presentado.",S1Gateway,0,0,,,,,2010-09-06 15:09:31,2987,26722
73,BancoAzteca,2020-10-17 17:53:21,"BancoAzteca que pasa no hay filtros de seguridad vaciaron cta de ahorro no hay seguimiento de queja cancelaron cta, mucho cuidado con poner ahi su dinero, miles de quejas y no hay respuesta dan no. de tel para seguimiento y no existe",Twitter for Android,0,0,"respuesta,seguridad,queja,dinero",,,,2019-11-21 16:01:20,29,0
75,BancoAzteca,2020-10-17 17:24:34,"BancoAzteca Al dar de alta una cuenta nueva, no la acepta y sale un recuadro que dice "" la app no funciona, intente mas tarde""",Twitter for Android,0,0,"cuenta,app",,,,2013-02-27 22:37:44,86,6
76,BancoAzteca,2020-10-17 17:21:23,"jjvr70 Buenas Tardes, Juan. ¿Qué problema estas presentando? con gusto te asesoramos.",S1Gateway,0,0,asesor,,,,2010-09-06 15:09:31,2987,26722
77,BancoAzteca,2020-10-17 17:15:55,QuirinoOC MazatlanFC BancoAzteca RicardoBSalinas Tío me puede reglar uno?🥺,Twitter for iPhone,0,0,,,,,2019-01-10 04:57:58,54,12
78,BancoAzteca,2020-10-17 17:14:51,"BancoAzteca buen dia, Esta fallando la aplicación para envio a otras cuentas...ojala se restablezca pronto!",Twitter for Android,0,0,cuenta,,,,2013-02-27 22:37:44,86,6
79,BancoAzteca,2020-10-17 17:07:03,"Te hemos visto crecer en todos los aspectos de tu vida, EdgarZaldivarV... 🤩  Esperamos con ansias tu regreso a las canchas. Por hoy, La Fiel y BancoAzteca te desean un muy feliz cumpleaños!!! 🥳  LateConFuria 🔴⚫️ https://t.co/jpYprNK3wP",Twitter Web App,1,0,,,,,2018-03-19 15:29:07,501,48
80,BancoAzteca,2020-10-17 16:47:20,"A pesar de la crisis actual, BancoAzteca cuenta con una cobranza sana y  mantiene una situación financiera estable, Revive la entrevista con Alejandro Valenzuela, director del banco  889Noticias rominarr  LaVillegas1 MarielenaVega  https://t.co/ifDgjFqyOz",Twitter for iPhone,1,0,"cuenta,banco,crisis",,,,2009-12-23 07:40:19,3108,4059
81,BancoAzteca,2020-10-17 16:46:24,atlasfc EdgarZaldivarV BancoAzteca Qué chingados le han visto crecer si llego de 17 años a las FB de Atlas,Twitter for iPhone,0,0,,,,,2018-01-31 15:02:16,819,30
84,BancoAzteca,2020-10-17 15:59:50,RicardoBSalinas No se le olvide pagar la factura por concepto de renta de ItalicaSilao filial De BancoAzteca que se le debe a Una persona de la tercera edad que se la rentó de buena fe ! https://t.co/EBJoKDMhvx,Twitter for iPhone,0,0,,,,,2009-06-04 00:59:59,1430,1117
85,BancoAzteca,2020-10-17 15:58:05,"Hoy abre las puertas por primera vez el Kraken del MazatlanFC. Esperemos que sea de su agrado, que disfruten y respeten las reglas.  Gracias por los nuevos Jerseys para la familia. 🤩😍 si dios quiere ahí estaremos. BancoAzteca RicardoBSalinas suerte PuroSinaloa 👊🏼 https://t.co/4BBPEogGFI",Twitter Web App,35,0,,,,,2020-07-13 15:29:38,616,163
86,BancoAzteca,2020-10-17 15:55:24,La bienestarmx  Realiza la dispersión en automático a la cuenta de los beneficiariios administrados por  BancoAzteca  Y éste te realiza la gestión y te obliga a contratar otros servicios que no solicitaste y aparte te abona tu crédito 7 días de$pue$,Twitter for Android,0,0,"cuenta,servicio,servicio",,,,2016-07-26 00:38:16,2187,1191
87,BancoAzteca,2020-10-17 15:52:34,"atlasfc BancoAzteca Y ustedes creen que este chaparro pecho frío de LuchoAcosta94 siente esa pasión ??, Que equivocados están !!!",Twitter for Android,0,0,,,,,2015-04-21 17:26:04,60,5
90,BancoAzteca,2020-10-17 15:42:30,Negociazo con los créditos a la palabra otorgados por la Secretaría de Economía y Secretaría del Bienestar  Administrados por  BancoAzteca,Twitter for Android,0,0,,,,,2016-07-26 00:38:16,2187,1191
91,BancoAzteca,2020-10-17 15:38:26,Ven con nosotros a disfrutar de los sueños de Vincent plasmados en obras inmortales. VanGoghAliveMX presentado por BancoAzteca. SueñasDecidesLogras   Compra tus boletos en https://t.co/kVwWU3nRNs https://t.co/4NPGKbFWs8,Twitter for iPhone,1,0,,,,,2020-06-20 05:42:30,192,28
93,BancoAzteca,2020-10-17 15:07:03,"tewtus64 con gusto te apoyamos reportando esta situación, para este proceso te pedimos nos apoyes con un mensaje directo. Muchas gracias por contactarnos.",S1Gateway,0,0,,,,,2010-09-06 15:09:31,2987,26722
94,BancoAzteca,2020-10-17 14:59:36,atlasfc BancoAzteca El enemigo de mi enemigo es mi amigo. 💪🏻 A darle en la madre a esos creciditos https://t.co/Y1iox6LF1f,Twitter for iPhone,0,0,,,,,2016-03-02 22:07:12,1269,148
102,BancoAzteca,2020-10-17 14:27:20,atlasfc BancoAzteca Simplemente metan huevos lo único que se les pide es que representen dignamente a la institución y afición y defiendan la camiseta a muerte ya si se gana  o se pierde es cosa del fútbol pero que no quede por actitud de los jugadores ánimo y MIL VECES ARRIBA EL ATLAS!!!,Twitter for iPhone,0,0,,,,,2011-05-13 14:46:40,180,3
103,BancoAzteca,2020-10-17 14:26:18,"Banorte_mx Hice todo el protocolo mandé documentos espere mucho tiempo el fallo de sus ""investigaciones"" y al final fallaron en contra mía ahhh y aparte voy a pagar la multa por la investigación son un fiasco de corporativo bancario BancoAzteca me lo soluciono al instante el problema",Twitter for Android,0,0,,,,,2020-06-01 03:57:31,43,2
104,BancoAzteca,2020-10-17 14:24:45,BancoAzteca Cajero autimático o19468 ñunca funciona,Twitter for Android,0,0,,,,,2017-09-18 21:12:19,301,18
105,BancoAzteca,2020-10-17 14:17:00,"tewtus64 Buenos Días, gracias por contactarnos. Con gusto te apoyamos y asesoramos con esta situación. Por favor envíanos un DM, esto por seguridad de tus datos. Estamos para servirte.",S1Gateway,0,0,"asesor,seguridad",,,,2010-09-06 15:09:31,2987,26722
108,BancoAzteca,2020-10-17 14:11:29,BancoAzteca para qué tener un cajero automático en su sucursal Cd Caucel Mérida Yuc. si NUNCA funciona. Mientras tanto hay que formarse y solo atiende un cajero físico. Cada vez que vengo lo reporto con los empleados pero de nada ha servido. Ojalá lo puedan solucionar.,Twitter for Android,0,0,sucursal,,,,2017-09-18 21:12:19,301,18
112,BancoAzteca,2020-10-17 13:59:11,atlasfc BancoAzteca Que no se usa  por que para mi los extranjeros nomas vienen a cobrar y no hacen nada mejor ese dinero que se les paga que lo inviertan en la cantera para jugadores que crezcan sabiendo lo que es el amor ala rojo y negra,Twitter for iPhone,0,0,dinero,,,,2019-05-26 23:02:02,6,1
113,BancoAzteca,2020-10-17 13:49:56,atlasfc BancoAzteca Que frío se siente aquí,Twitter for iPhone,0,0,,,,,2018-09-20 14:16:30,864,76
116,BancoAzteca,2020-10-17 13:35:54,atlasfc BancoAzteca Váyanse al pito,Twitter for Android,0,0,,,,,2020-02-16 01:16:39,531,15
117,BancoAzteca,2020-10-17 13:35:53,atlasfc Orlegi_Sports BancoAzteca Los últimos años han sido una decepción en los clásicos. Ojalá hoy nos sorprendan,Twitter for Android,0,2,,,,,2015-06-04 22:10:26,428,84
118,BancoAzteca,2020-10-17 13:35:40,emilioponce9891 atlasfc BancoAzteca Eso ya no se usa,Twitter for Android,0,0,,,,,2020-02-16 01:16:39,531,15
121,BancoAzteca,2020-10-17 13:23:51,atlasfc BancoAzteca Juegenlo con canteranos hay mas chance de ganar que con los extranjeros pecho frio que tienen ahorita los canteranos si sienten la playera,Twitter for iPhone,0,1,,US,city,"San Angelo, TX",2019-05-26 23:02:02,6,1
123,BancoAzteca,2020-10-17 13:09:14,atlasfc BancoAzteca Eso espero,Twitter for Android,0,0,,,,,2020-05-06 13:21:35,70,15
125,BancoAzteca,2020-10-17 13:03:06,atlasfc BancoAzteca Cuando es el partido,Twitter for Android,0,0,,,,,2019-07-05 18:44:16,9,7
129,BancoAzteca,2020-10-17 12:22:46,LGsus90 gruposalinas RicardoBSalinas arteyculturags CinetecaMexico BancoAzteca izzi_mx Jajajaja. De dónde sacas que izzi pertenece a grupo salinas?,Twitter for Android,0,0,,,,,2020-09-06 14:12:10,20,2
130,BancoAzteca,2020-10-17 10:37:33,QuirinoOC MazatlanFC BancoAzteca RicardoBSalinas Cancele el Carnaval no mame!,Twitter for Android,0,0,,,,,2018-06-09 18:57:48,647,18
131,BancoAzteca,2020-10-17 09:13:39,AmilkarDgzz QuirinoOC MazatlanFC BancoAzteca RicardoBSalinas Para eso están las autoridades si alguno no respeta.,Twitter for iPhone,0,0,,,,,2009-07-08 06:52:13,1579,175
132,BancoAzteca,2020-10-17 09:13:09,sektor107 QuirinoOC MazatlanFC BancoAzteca RicardoBSalinas Bueno siendo un destino turístico MZT tiene mucho sentido tener un equipo de fútbol. Si traes 5000 personas cada fin de semana son 2500 cuartos de hotel que benefician a miles de familias. Por eso parte de los recursos pueden ser públicos.,Twitter for iPhone,0,0,,,,,2009-07-08 06:52:13,1579,175
133,BancoAzteca,2020-10-17 09:08:21,MazatlanFC QuirinoOC BancoAzteca RicardoBSalinas Si somos. A Web...,Twitter for iPhone,0,0,,,,,2009-07-08 06:52:13,1579,175
134,BancoAzteca,2020-10-17 07:33:17,QuirinoOC MazatlanFC BancoAzteca RicardoBSalinas Con sus respectivos protocolos claro,Twitter for Android,0,0,,,,,2015-09-04 06:07:15,1879,1980
135,BancoAzteca,2020-10-17 07:28:10,"rt vía Twitter by Silviadgn ➡ ""BancoAzteca bienestarmx Reportó q no está funcionando el cajero de Taxqueña y Tláhuac. Por qué le dan la concesión de las tarjetas bienestar si Banco Azteca no tiene la infraestructura de soporte. Ayer no funcionaban … https://t.co/FGZwpaprij",IFTTT,0,0,tarjeta,,,,2015-09-01 02:27:59,896,3971
136,BancoAzteca,2020-10-17 07:24:44,"julioastillero Y RicardoBSalinas hace lo mismo con BancoAzteca ,desaparecen dinero de cuentas digitales.  CondusefMX GobiernoMX lopezobrador_ SEGOB_mx SATMX senadomexicano DiputadosMorena",Twitter for iPad,0,0,"cuenta,dinero",,,,2011-10-16 06:25:21,946,45
137,BancoAzteca,2020-10-17 06:00:49,MazatlanFC QuirinoOC BancoAzteca RicardoBSalinas Pero no de esa forma,Twitter for Android,0,0,,,,,2009-11-07 15:05:56,1982,158
138,BancoAzteca,2020-10-17 05:56:08,EdgarBejarano12 QuirinoOC MazatlanFC BancoAzteca RicardoBSalinas Mazatlán en números rojos y con gente asistiendo a los estadios (fútbol y baseball) Y los trabajadores de la salud partiendo se el alma por atender a toda la ola de contagios por estos eventos,Twitter for Android,0,3,,,,,2009-11-07 15:05:56,1982,158
140,BancoAzteca,2020-10-17 05:29:57,"DuranAdurann75 EdgarBejarano12 MazatlanFC BancoAzteca RicardoBSalinas Ps no vayas y ya compa 🤷🏽‍♂️ Deje de mamar, chico bueno y sabio",Twitter for iPhone,0,0,bueno,,,,2011-01-12 22:38:08,594,679
141,BancoAzteca,2020-10-17 05:24:27,Unete!! Que esperas!! Todo el BancoAzteca unido https://t.co/bObeO5IAlQ,Twitter for iPhone,0,1,,,,,2019-06-22 00:10:44,100,44
142,BancoAzteca,2020-10-17 04:50:18,"QuirinoOC MazatlanFC BancoAzteca RicardoBSalinas Ese joven ya tiene su historial desde la temporada pasada, el problema es que no somos estricto en hacer cumplir el protocolo de contingencia dentro de las instalaciones de los estadios. Y es cierto que mucho depende de nosotros mismos y la mejor medida es no asistir. Suerte👍",Twitter for Android,0,2,,,,,2016-06-06 23:06:02,493,41
143,BancoAzteca,2020-10-17 04:42:01,QuirinoOC MazatlanFC BancoAzteca RicardoBSalinas Tantas vidas perdidas de personal médico más jordanas agotadoras y en constante riesgo para que nuestro querido gobierno autorice eventos como abrir el estadio clubtomateros estradaferreiro QuirinoOC  vergüenza total,Twitter for Android,2,0,,,,,2011-07-19 20:30:58,400,59
144,BancoAzteca,2020-10-17 04:26:22,"RicardoBSalinas Que bueno que se encuentra muy bien, pero lo que realmente nos preocupa es cuando empezará apagar la deuda que tiene con todos los mexicanos, evitenos mandarle cobratarios con chalecos y acosadores como hace Elektra y BancoAzteca",Twitter for Android,1,0,bueno,,,,2011-06-24 17:16:54,2031,2216
146,BancoAzteca,2020-10-17 04:01:28,QuirinoOC MazatlanFC BancoAzteca RicardoBSalinas Jajajaja si como no ya con unos botes en la cabeza noc  me parece una mala que digo mala malísima idea pero pues es su responsabilidad de aquí en adelante,Twitter Web App,0,0,,,,,2019-05-20 19:33:05,122,6
147,BancoAzteca,2020-10-17 03:58:58,"QuirinoOC MazatlanFC BancoAzteca RicardoBSalinas Por qué el 24 gober,",Twitter for Android,0,0,,,,,2014-08-12 00:24:03,190,151
148,BancoAzteca,2020-10-17 03:43:55,QuirinoOC MazatlanFC BancoAzteca RicardoBSalinas Sobretodo... https://t.co/gxaaI2Rusu,Twitter for Android,0,0,,,,,2017-01-01 21:54:34,1543,267
149,BancoAzteca,2020-10-17 03:39:47,RicardoBSalinas Tiendas_Elektra BancoAzteca totalplaymx Azteca Órale a pagar!!!! Rodpac NegociosImagen ElFinanciero_Mx PedroFerriz CiroGomezL BMVMercados Vicente_Galvez beltrandelrio franciscozea RicardoAlemanMx https://t.co/uSAKqFWTqV,Twitter for Android,0,0,,,,,2011-04-23 11:59:40,632,505
